id,escenario,condicion,mediciones,objetivo,resultado_esperado,clasificacion_permitida,estado
SS-SIG-001,Dispositivo colocado nado frontal,"Atleta boca abajo, crol suave, normal y fuerte","Paquetes recibidos/perdidos; intervalos; BLE RSSI; IMU; agua; video sincronizado","Medir patron normal de exposicion e inmersion dorsal","Intermitencias asociadas a rolido, oleaje y brazada","NADO_ADHERIDO_REFERENCIA",PENDIENTE
SS-SIG-002,Dispositivo colocado nado espalda,"Atleta boca arriba con dispositivo posiblemente sumergido","Paquetes recibidos/perdidos; intervalos; BLE RSSI; IMU; agua; video sincronizado","Determinar si una postura valida produce perdida prolongada de comunicacion","Patron diferenciable del nado frontal y del equipo suelto","POSTURA_VALIDA_SENAL_DEBIL",PENDIENTE
SS-SIG-003,Dispositivo colocado flotacion vertical,"Atleta flotando o pedaleando en posicion vertical","Paquetes recibidos/perdidos; intervalos; BLE RSSI; IMU; agua; video sincronizado","Caracterizar pausa o espera segura","Mantener contexto suficiente para evitar emergencia automatica inmediata","PAUSA_REQUIERE_CONTEXTO",PENDIENTE
SS-SIG-004,Dispositivo suelto autoenderezado,"Equipo liberado y flotando con antena arriba","Paquetes; BLE RSSI; IMU; agua; GNSS disponible; video","Caracterizar firma del dispositivo libre correctamente orientado","Senal relativamente estable y movimiento gobernado por oleaje, sin periodicidad corporal","POSIBLE_DISPOSITIVO_A_LA_DERIVA",PENDIENTE
SS-SIG-005,Dispositivo suelto no enderezado,"Equipo liberado invertido o girando","Paquetes; BLE RSSI; IMU; agua; video","Comprobar autoenderezamiento y efecto sobre comunicacion","Debe enderezarse dentro del tiempo objetivo a definir","FALLO_AUTOENDEREZAMIENTO",PENDIENTE
SS-SIG-006,Inmersion controlada,"Equipo sujeto bajo superficie a profundidades y tiempos controlados, sin persona en riesgo","Profundidad aproximada; paquetes; RSSI; tiempo de perdida y recuperacion; IMU; agua","Medir relacion entre inmersion y perdida/recuperacion de señal","Construir referencia experimental; no declarar hundimiento desde señal sola","INMERSION_CONTROLADA",PENDIENTE
SS-SIG-007,Perdida de cobertura sin inmersion,"Equipo seco o sobre superficie alejandose o entrando a zona de cobertura debil","Paquetes; RSSI; ubicacion; calidad celular futura; video/log","Separar cobertura deficiente de inmersion","Patron de degradacion espacial distinto de perdida brusca por agua cuando sea posible","COBERTURA_DEBIL",PENDIENTE
SS-SIG-008,Recuperacion posterior,"Luego de cualquier perdida el equipo recupera enlace","Duracion sin enlace; primer paquete; backlog; ultima posicion; estado IMU/agua","Validar mensaje prioritario al recuperar señal","Enviar primero resumen de ausencia y luego datos acumulados","RECUPERACION_COMUNICACION",PENDIENTE
